,audio_filepath,start,end,text,pronunciation
435,/kaggle/input/audio-files/Audio_Files/7M4DQHf1J2A.wav,1840.96,1846.799,ομιλία τζαί πολλές άλλες Μου αρέσει να βρίσκομαι,omilia dze poles alez mu aresi na vriskome
436,/kaggle/input/audio-files/Audio_Files/7M4DQHf1J2A.wav,1844.159,1848.08,στη σκηνή Έτσι ακόμα τζαί όταν ήμουν παιδί το,sti scini etsi akoma dze otan imum bethi to
437,/kaggle/input/audio-files/Audio_Files/7M4DQHf1J2A.wav,1846.799,1850.24,μόνο πράγμα που μου άρεσε να κάνω ήταν να,mono praghma pu mu arese na kano itan na
438,/kaggle/input/audio-files/Audio_Files/7M4DQHf1J2A.wav,1848.08,1852.88,τραγουδάω Έτσι λοιπόν τραγουδούσα Στέκομαι στις,traghuthao etsi lipon draghuthusa stekome stis
439,/kaggle/input/audio-files/Audio_Files/7M4DQHf1J2A.wav,1850.24,1854.72,σκηνές τζαί τραγουδάω Τζαί το προβλέπω αυτό,scines dze traghuthao dze to provlepo afto
440,/kaggle/input/audio-files/Audio_Files/7M4DQHf1J2A.wav,1852.88,1856.64,τζαί στο μέλλον Εντάξει αυτό είναι ωραίο,dze sto melon edaksi afto ine oreo
441,/kaggle/input/audio-files/Audio_Files/7M4DQHf1J2A.wav,1854.72,1858.24,Ναι Δεκάρα Σου εύχομαι ότι καλύτερο,ne thekara su efchome oti kalitero
442,/kaggle/input/audio-files/Audio_Files/7M4DQHf1J2A.wav,1856.64,1860.64,Σας ευχαριστώ πολύ Ευχαριστώ που ήρθες,sas efcharisto poli efcharisto pu irthes
443,/kaggle/input/audio-files/Audio_Files/7M4DQHf1J2A.wav,1858.24,1862.88,Ήταν πολύ της τελευταίας στιγμής Ήταν πολύ της,itam boli tis telefteas stighmis itam boli tis
444,/kaggle/input/audio-files/Audio_Files/7M4DQHf1J2A.wav,1860.64,1864.72,τελευταίας στιγμής Μπορεί να κάνω,telefteas stighmiz bori na kano
445,/kaggle/input/audio-files/Audio_Files/7M4DQHf1J2A.wav,1862.88,1866.88,ψυχοθεραπεία μαζί σου έννα ήθελα πολύ να σε έχω,psichotherapia mazi su ena ithela poli na se echo
446,/kaggle/input/audio-files/Audio_Files/7M4DQHf1J2A.wav,1864.72,1869.12,αν έχεις χρόνο Όπως έννα ήθελα πολύ να,an eçis chrono opos ena ithela poli na
447,/kaggle/input/audio-files/Audio_Files/7M4DQHf1J2A.wav,1866.88,1873.12,είμαι πελάτης σας Υπάρχει όποιος,ime pelatis sas iparçi opios
448,/kaggle/input/audio-files/Audio_Files/7M4DQHf1J2A.wav,1869.12,1876.48,θέλει θεραπεία στην Κύπρο,theli therapia stiŋ ɡipro
449,/kaggle/input/audio-files/Audio_Files/7M4DQHf1J2A.wav,1873.12,1879.0,Ηλία Ελένη Ελένη Ελένη Η Ελένη είναι ένα,ilia eleni eleni eleni i eleni ine ena
450,/kaggle/input/audio-files/Audio_Files/7M4DQHf1J2A.wav,1876.48,1881.36,άτομο στο οποίο αξίζει να απευθυνθείς Πολύ όμορφη,atomo sto opio aksizi n apefthinthis poli omorfi
451,/kaggle/input/audio-files/Audio_Files/7M4DQHf1J2A.wav,1879.0,1883.039,κυρία Ευχαριστώ πολύ που ήρθατε Το,ciria efcharisto poli pu irthate to
452,/kaggle/input/audio-files/Audio_Files/7M4DQHf1J2A.wav,1881.36,1884.32,εκτιμώ Σας ευχαριστώ πολύ Ευχαριστώ,ektimo sas efcharisto poli efcharisto
453,/kaggle/input/audio-files/Audio_Files/7M4DQHf1J2A.wav,1883.039,1887.12,πολύ που με καλέσατε Ήταν,poli pu me kalesate itan
454,/kaggle/input/audio-files/Audio_Files/7M4DQHf1J2A.wav,1884.32,1887.12,χαρά μου που βρίσκομαι εδώ Ευχαριστώ,chara mu pu vriskome etho efcharisto
455,/kaggle/input/audio-files/Audio_Files/j9bhm8OVMQc.wav,2.24,10.2,βαθύ ποτάμι ο,vathi potami omikron
456,/kaggle/input/audio-files/Audio_Files/j9bhm8OVMQc.wav,5.5600000000000005,13.599,έρωτας με το φιλίνα,erotaz me to filina
457,/kaggle/input/audio-files/Audio_Files/j9bhm8OVMQc.wav,10.2,16.84,τρέμει ψάχνω στα,tremi psachno sta
458,/kaggle/input/audio-files/Audio_Files/j9bhm8OVMQc.wav,13.599,19.56,διάφανα νερά,thiafana nera
459,/kaggle/input/audio-files/Audio_Files/j9bhm8OVMQc.wav,16.84,23.64,νυχτερινό,nichterino
460,/kaggle/input/audio-files/Audio_Files/j9bhm8OVMQc.wav,19.56,25.84,μελτέμ κι από την όχθη,meltem ci apo tin ochthi
461,/kaggle/input/audio-files/Audio_Files/j9bhm8OVMQc.wav,23.64,28.96,χύνονται στου,çinode stu
462,/kaggle/input/audio-files/Audio_Files/j9bhm8OVMQc.wav,25.84,31.599,ποταμο τα,potamo ta
463,/kaggle/input/audio-files/Audio_Files/j9bhm8OVMQc.wav,28.96,34.879,βάθη,vathi
464,/kaggle/input/audio-files/Audio_Files/j9bhm8OVMQc.wav,31.599,38.28,κόκκινο κρασί να,kocino krasi na
465,/kaggle/input/audio-files/Audio_Files/j9bhm8OVMQc.wav,34.879,38.28,ψαν τα,psan da
466,/kaggle/input/audio-files/Audio_Files/j9bhm8OVMQc.wav,40.92,45.96,πά τη στιγμή που έγινε ο πυροβολισμός,pa ti stighmi pu ejine o pirovolismos
467,/kaggle/input/audio-files/Audio_Files/j9bhm8OVMQc.wav,43.719,47.8,είχαμε μια συζήτηση με τον ματθαίο,ichame mnya sizitisi me ton mattheo
468,/kaggle/input/audio-files/Audio_Files/j9bhm8OVMQc.wav,45.96,50.84,επιμένει πως υπάρχει μια αλήθεια για τη,epimeni pos iparçi mny alithça ja ti
469,/kaggle/input/audio-files/Audio_Files/j9bhm8OVMQc.wav,47.8,52.079,διάλυση του γάμου μας τότε έννα στο πω για,thialisi tu ghamu mas tote ena sto po ja
470,/kaggle/input/audio-files/Audio_Files/j9bhm8OVMQc.wav,50.84,55.079,τελευταία,teleftea
471,/kaggle/input/audio-files/Audio_Files/j9bhm8OVMQc.wav,52.079,57.52,φορά είναι ένοχος πς αυτό τζαί λέει,fora ine enochos pisighm afto dze lei
472,/kaggle/input/audio-files/Audio_Files/j9bhm8OVMQc.wav,55.079,57.52,βλακίες,vlacies
473,/kaggle/input/audio-files/Audio_Files/j9bhm8OVMQc.wav,58.039,62.12,κυρία νικολάου,ciria nikolau
474,/kaggle/input/audio-files/Audio_Files/j9bhm8OVMQc.wav,60.44,65.12,καλημέρα του θεού,kalimera tu theu
475,/kaggle/input/audio-files/Audio_Files/j9bhm8OVMQc.wav,62.12,65.12,είναι,ine
476,/kaggle/input/audio-files/Audio_Files/j9bhm8OVMQc.wav,67.56,73.0,καλημέρα ρε σε,kalimera re se
477,/kaggle/input/audio-files/Audio_Files/j9bhm8OVMQc.wav,69.96000000000001,75.159,μάρκο ήντα γυρεύει εδώ η κυρία απίθανη τζαί,marko ida jirevi etho i ciri apithani dze
478,/kaggle/input/audio-files/Audio_Files/j9bhm8OVMQc.wav,73.0,78.119,γιατί την είπες κυρία νικολάου γιατί την,jati tin ipes ciria nikolau jati tin
479,/kaggle/input/audio-files/Audio_Files/j9bhm8OVMQc.wav,75.159,79.84,ξέρεις ήντα μπουμπού είπε εξαίρεση με,kseris ida bubu ipe ekseresi me
480,/kaggle/input/audio-files/Audio_Files/j9bhm8OVMQc.wav,78.119,81.479,κάνες εσύ υπε εξαίρεση για να δώσεις,kanes esi ipe ekseresi jana thosis
481,/kaggle/input/audio-files/Audio_Files/j9bhm8OVMQc.wav,79.84,84.56,ριάλια του θάνου να κάνει δουλειά στο,riaʎa tu thanu na kani thuʎa sto
482,/kaggle/input/audio-files/Audio_Files/j9bhm8OVMQc.wav,81.479,86.439,λονδίνο ναι με είχαν σύμβουλοι,lonthino ne me ichan simvuli
483,/kaggle/input/audio-files/Audio_Files/j9bhm8OVMQc.wav,84.56,88.24,επενδύσεων τότε ο μιχάλης ιωάννου μαζί,epenthiseon dote o michalis ioanu mazi
484,/kaggle/input/audio-files/Audio_Files/j9bhm8OVMQc.wav,86.439,91.28,με κάτι άλλους επιχειρηματίες τους δύο,me kati alus epiçirimaties tuz thio
485,/kaggle/input/audio-files/Audio_Files/j9bhm8OVMQc.wav,88.24,94.36,γνώρισα ποντάραμε κά κάπου τζαί κάναμε,ghnorisa podarame ka kapu dze kaname
486,/kaggle/input/audio-files/Audio_Files/j9bhm8OVMQc.wav,91.28,96.439,τρελά κι φεύγει πάλι αντώνη ακούς παρόλο,trela ci fevji pali adoni akus parolo
487,/kaggle/input/audio-files/Audio_Files/j9bhm8OVMQc.wav,94.36,98.32,το σκηνικό που έγινε με το ματθαίο ε,to sciniko pu ejine me to mattheo epsilon
488,/kaggle/input/audio-files/Audio_Files/j9bhm8OVMQc.wav,96.439,100.88,σσιάζουμαι ο πρώην σου εν καταλαβαίνει,ssjazume o proin su eŋ ɡatalaveni
489,/kaggle/input/audio-files/Audio_Files/j9bhm8OVMQc.wav,98.32,104.2,τίποτα ούτε εγώ όμως λοιπόν πάρ τον επί,tipota ute egho omoz lipom bar ton epi
490,/kaggle/input/audio-files/Audio_Files/j9bhm8OVMQc.wav,100.88,106.52,τόπου ναι τον αδερφό σου τον ματθαίο έννα,topu ne ton atherfo su ton mattheo ena
491,/kaggle/input/audio-files/Audio_Files/j9bhm8OVMQc.wav,104.2,110.119,μπορούσαμε να τον είχαμε σκοτώσει εν το,borusame na ton ichame skotosi en do
492,/kaggle/input/audio-files/Audio_Files/j9bhm8OVMQc.wav,106.52,115.04,κάναμε την επόμενη φορά αν εν έρθεις,kaname tin epomeni fora an en erthis
493,/kaggle/input/audio-files/Audio_Files/j9bhm8OVMQc.wav,110.119,115.04,κύπρο σειρά έσιει γκόμενά σου,cipro sira esji ɡomena su
494,/kaggle/input/audio-files/Audio_Files/j9bhm8OVMQc.wav,125.56,128.56,βοήθεια,voithça
495,/kaggle/input/audio-files/Audio_Files/j9bhm8OVMQc.wav,147.68,152.64,βοήθεια μελίνα,voithça melina
496,/kaggle/input/audio-files/Audio_Files/j9bhm8OVMQc.wav,150.2,152.64,άσε την,ase tin
497,/kaggle/input/audio-files/Audio_Files/j9bhm8OVMQc.wav,157.07999999999998,161.07999999999998,τσάντα ήντα έγινε είσαι,tsada ida ejine ise
498,/kaggle/input/audio-files/Audio_Files/j9bhm8OVMQc.wav,161.159,166.68,καλά τρέχει,kala treçi
499,/kaggle/input/audio-files/Audio_Files/j9bhm8OVMQc.wav,163.8,168.64,γαίμα τρόμαξα τα κλειδιά είναι στην,jema tromaksa ta klithia ine stin
500,/kaggle/input/audio-files/Audio_Files/j9bhm8OVMQc.wav,166.68,170.2,τσάντα πώς έννα πούμε σπίτι έννα πάμε στη,tsada pos ena pume spiti ena pame sti
501,/kaggle/input/audio-files/Audio_Files/j9bhm8OVMQc.wav,168.64,171.959,πμε στην αστυνομία να το καταγγείλουμε,pme stin astinomia na to kataŋɡilume
502,/kaggle/input/audio-files/Audio_Files/j9bhm8OVMQc.wav,170.2,176.48,όι όι όι στην αστυνομία σε παρακαλώ,oɪ oɪ oɪ stin astinomia se parakalo
503,/kaggle/input/audio-files/Audio_Files/j9bhm8OVMQc.wav,171.959,176.48,πολύ αου έλα έλα ενά,poli au ela ela ena
504,/kaggle/input/audio-files/Audio_Files/j9bhm8OVMQc.wav,183.2,189.239,απίστευτο ο δάφνη πληρωνόταν από άντρες,apistefto o thafni plironotan apo adres
505,/kaggle/input/audio-files/Audio_Files/j9bhm8OVMQc.wav,186.84,189.239,ήτανε,itane
506,/kaggle/input/audio-files/Audio_Files/j9bhm8OVMQc.wav,189.48,197.08,δηλαδή ήντα φοβάσαι να πεις τη λέξη πες,thilathi ida fovase na pis ti leksi pes
507,/kaggle/input/audio-files/Audio_Files/j9bhm8OVMQc.wav,194.28,200.28,την ιερόδουλη αν εν μπορείς να το πεις,tin ierothuli an en boriz na to pis
508,/kaggle/input/audio-files/Audio_Files/j9bhm8OVMQc.wav,197.08,203.04,άλλωσπως ήντα κάνουμε,alospos ida kanume
509,/kaggle/input/audio-files/Audio_Files/j9bhm8OVMQc.wav,200.28,205.44,τώρα εσείς έννα αποφασίσετε,tora esis en apofasisete
510,/kaggle/input/audio-files/Audio_Files/j9bhm8OVMQc.wav,203.04,207.319,είναι αλήθεια ότι για τζείνη είναι,ine alithça oti ja dzini ine
511,/kaggle/input/audio-files/Audio_Files/j9bhm8OVMQc.wav,205.44,209.239,δύσκολα τα πράγματα αλλά εσάς μπορεί να,thiskola ta praghmata ala esaz bori na
512,/kaggle/input/audio-files/Audio_Files/j9bhm8OVMQc.wav,207.319,212.12,σας βολεύει γιατί αν το μάθει ο θείος,saz volevi jati an do mathi o thios
513,/kaggle/input/audio-files/Audio_Files/j9bhm8OVMQc.wav,209.239,215.12,σας έννα της πάρει πίσω ότι της είχε δώσει,sas ena tis pari piso oti tis içe thosi
514,/kaggle/input/audio-files/Audio_Files/j9bhm8OVMQc.wav,212.12,216.76,κάτσε μάρκο εννεν τόσο απλό εκτός,katse marko enen doso aplo ektos
515,/kaggle/input/audio-files/Audio_Files/j9bhm8OVMQc.wav,215.12,219.519,από το οικονομικό υπάρχει τζαί ένα,apo to ikonomiko iparçi dze ena
516,/kaggle/input/audio-files/Audio_Files/j9bhm8OVMQc.wav,216.76,221.439,τεράστιο ηθικό θέμα εδώ πέρα αν η δάφνη,terastio ithiko thema etho pera an i thafni
517,/kaggle/input/audio-files/Audio_Files/j9bhm8OVMQc.wav,219.519,223.599,όλα αυτά τα χρόνια ξεγελούσε το θείο μου,ol afta ta chronya ksejeluse to thio mu
518,/kaggle/input/audio-files/Audio_Files/j9bhm8OVMQc.wav,221.439,227.08,τζαί αυτό μαθευτεί έννα γίνουμε ρεζίλι ογε,dze afto mathefti ena jinume rezili oje
519,/kaggle/input/audio-files/Audio_Files/j9bhm8OVMQc.wav,223.599,228.68,ός ναι πρέπει να κρατηθεί κρυφό τζαί εν,oz ne prepi na kratithi krifo dze en
520,/kaggle/input/audio-files/Audio_Files/j9bhm8OVMQc.wav,227.08,231.319,έννα κάνουμε καμία κίνηση αν εν,ena kanume kamia cinisi an en
521,/kaggle/input/audio-files/Audio_Files/j9bhm8OVMQc.wav,228.68,233.36,βεβαιωθούμε έχω τη διεύθυνση απ το,veveothume echo ti thiefthinsi ap to
522,/kaggle/input/audio-files/Audio_Files/j9bhm8OVMQc.wav,231.319,236.04,στούντιο που είχες στο κολωνάκι θες να,studio pu içes sto kolonaci thez na
523,/kaggle/input/audio-files/Audio_Files/j9bhm8OVMQc.wav,233.36,240.64,το κοιτάξω ναι αλλά θέλω να το τσεκάρω κ,to citakso ne ala thelo na to tsekaro kapa
524,/kaggle/input/audio-files/Audio_Files/j9bhm8OVMQc.wav,236.04,242.519,εγώ εντάξει λοιπόν φεύγω αύριο για κύπρο,egho edaksi lipon fevgho avrio ja cipro
525,/kaggle/input/audio-files/Audio_Files/j9bhm8OVMQc.wav,240.64,244.36,ήντα ήταν αυτό που έμαθα πυροβολήσουν τον,ida itan afto pu ematha pirovolisun don
526,/kaggle/input/audio-files/Audio_Files/j9bhm8OVMQc.wav,242.519,249.36,μαθο έχουνε βήξει τα,matho echune viksi ta
527,/kaggle/input/audio-files/Audio_Files/j9bhm8OVMQc.wav,244.36,252.2,χανιά ναι είμα σαν μαζί τζείνη την ώρα α,chanya ne ima san mazi dzini tin or alfa
528,/kaggle/input/audio-files/Audio_Files/j9bhm8OVMQc.wav,249.36,256.56,ωστε ξανα σμίξαν αυτό μην το ξαναπείς,oste ksana smiksan afto min do ksanapis
529,/kaggle/input/audio-files/Audio_Files/j9bhm8OVMQc.wav,252.2,258.44,ούτε για πλάκα εντάξει λοιπόν αν μάθω,ute ja plaka edaksi lipon an matho
530,/kaggle/input/audio-files/Audio_Files/j9bhm8OVMQc.wav,256.56,259.959,κάτι έννα σε πάρω τηλέφωνο ούτως άλλους έννα,kati ena se paro tilefono utos alus ena
531,/kaggle/input/audio-files/Audio_Files/j9bhm8OVMQc.wav,258.44,262.759,τα ξαναπούμε σε μία εβδομ α πουθ ρθω,ta ksanapume se mia evthom alfa puth rtho
532,/kaggle/input/audio-files/Audio_Files/j9bhm8OVMQc.wav,259.959,262.759,χανιά,chanya
533,/kaggle/input/audio-files/Audio_Files/j9bhm8OVMQc.wav,266.68,272.039,καληνύχτα ήντα ήταν αυτό που ακούσαμε ποιο,kalinichta ida itan afto pu akusame pio
534,/kaggle/input/audio-files/Audio_Files/j9bhm8OVMQc.wav,269.96,274.84000000000003,απ τα δύο αυτό που είπε για σένα τζαί το,ap ta thio afto pu ipe ja sena dze to
535,/kaggle/input/audio-files/Audio_Files/j9bhm8OVMQc.wav,272.039,274.84000000000003,ματθαίο όξα για τη,mattheo oksa ja ti
536,/kaggle/input/audio-files/Audio_Files/j9bhm8OVMQc.wav,281.36,287.84000000000003,δάφνη επιτέλους φύγανε να γυρίσουμε,thafni epitelus fighane na jirisume
537,/kaggle/input/audio-files/Audio_Files/j9bhm8OVMQc.wav,284.96,291.039,στους ρυθμούς μας αχ αυτό το κοριτσάκι η,stuz rithmuz mas ach afto to koritsaci ita
538,/kaggle/input/audio-files/Audio_Files/j9bhm8OVMQc.wav,287.84000000000003,292.36,μικρή μαρίνα διαολο διαμαντή μου διαολο,mikri marina thiaolo thiamadi mu thiaolo
539,/kaggle/input/audio-files/Audio_Files/j9bhm8OVMQc.wav,291.039,295.28,ζωή να,zoi na
540,/kaggle/input/audio-files/Audio_Files/j9bhm8OVMQc.wav,292.36,300.68,χει,çi
541,/kaggle/input/audio-files/Audio_Files/j9bhm8OVMQc.wav,295.28,300.68,ναι αφηρημένος ήντα συμβαίνει,ne afirimenos ida simveni
542,/kaggle/input/audio-files/Audio_Files/j9bhm8OVMQc.wav,301.32,306.84,σκέφτομαι το μικρό τον ματθαίο τον,sceftome to mikro ton mattheo ton
543,/kaggle/input/audio-files/Audio_Files/j9bhm8OVMQc.wav,303.08,308.4,αχιλλέα γιατί α γι αυτό που είπε ότι,açilea jati alfa ji afto pu ipe oti
544,/kaggle/input/audio-files/Audio_Files/j9bhm8OVMQc.wav,306.84,310.919,είναι σίγουρος ότι εν έβαλλε η,ine sighuros oti en evale ita
545,/kaggle/input/audio-files/Audio_Files/j9bhm8OVMQc.wav,308.4,313.52,αναστασία να πυροβολήσουν τον αδελφό,anastasia na pirovolisun don athelfo
546,/kaggle/input/audio-files/Audio_Files/j9bhm8OVMQc.wav,310.919,317.759,του πώς είναι τόσο,tu pos ine toso
547,/kaggle/input/audio-files/Audio_Files/j9bhm8OVMQc.wav,313.52,320.84,σίγουρος εμείς εν είμαστε εδώ εν ξέρω,sighuros emis en imaste etho eŋ ɡzero
548,/kaggle/input/audio-files/Audio_Files/j9bhm8OVMQc.wav,317.759,323.039,εί περίεργο παιδί αυτό εδώ παράτησε τα,i periergho pethi afto etho paratise ta
549,/kaggle/input/audio-files/Audio_Files/j9bhm8OVMQc.wav,320.84,325.639,κρασιά τζαί πήγε στο,krasja dze pije sto
550,/kaggle/input/audio-files/Audio_Files/j9bhm8OVMQc.wav,323.039,328.639,λονδίνο γι αυτό είναι σκοτωμένα τα,lonthino ji afto ine skotomena ta
551,/kaggle/input/audio-files/Audio_Files/j9bhm8OVMQc.wav,325.639,330.919,αδέρφια πώς σου ρθε τώρα αυτό ποιος το,atherfia pos su rthe tor afto pios to
552,/kaggle/input/audio-files/Audio_Files/j9bhm8OVMQc.wav,328.639,333.56,ππα μόνος μου το,pa monoz mu to
553,/kaggle/input/audio-files/Audio_Files/j9bhm8OVMQc.wav,330.919,335.4,κατάλαβα ούτε ο λεπτά εν έμεινε στο,katalava ute o lepta en emine sto
554,/kaggle/input/audio-files/Audio_Files/j9bhm8OVMQc.wav,333.56,338.039,δωμάτιο τζαί μόλις βγήκε είπε ότι ο,thomatio dze moliz vjice ipe oti omikron
555,/kaggle/input/audio-files/Audio_Files/j9bhm8OVMQc.wav,335.4,341.16,ματθαίος κοιμότανε τζαί μετά ένα λεπτό,mattheos cimotane dze meta ena lepto
556,/kaggle/input/audio-files/Audio_Files/j9bhm8OVMQc.wav,338.039,344.919,μαθεος ήτανε στην κουζίνα να πίνει,matheos itane stiŋ ɡuzina na pini
557,/kaggle/input/audio-files/Audio_Files/j9bhm8OVMQc.wav,341.16,346.12,νερό ήταν πρόφαση για να μας ρίξω στάχτη,nero itam brofasi jana maz rikso stachti
558,/kaggle/input/audio-files/Audio_Files/j9bhm8OVMQc.wav,344.919,349.759,στα,sta
559,/kaggle/input/audio-files/Audio_Files/j9bhm8OVMQc.wav,346.12,353.44,μάτια τζαί με τη γυναίκα του ψυχρός μου,matia dze me ti jineka tu psichroz mu
560,/kaggle/input/audio-files/Audio_Files/j9bhm8OVMQc.wav,349.759,355.639,φάνηκε ο αχιλλέας α εγώ εν κατάλαβα,fanice o açileas alfa egho eŋ ɡatalava
561,/kaggle/input/audio-files/Audio_Files/j9bhm8OVMQc.wav,353.44,357.639,κάτι από πότε έγινες κουτσομπόλης εσύ,kati apo pote ejines kutsobolis esi
562,/kaggle/input/audio-files/Audio_Files/j9bhm8OVMQc.wav,355.639,359.12,διαμαντή μου α ήντα μας ενδιαφέρει τη κανε,thiamadi mu alfa ida mas enthiaferi ti kane
563,/kaggle/input/audio-files/Audio_Files/j9bhm8OVMQc.wav,357.639,361.639,ο αχιλλέας με τον αδελφό του τζαί τη,o açileaz me ton athelfo tu dze ti
564,/kaggle/input/audio-files/Audio_Files/j9bhm8OVMQc.wav,359.12,361.639,γυναίκα του,jineka tu
565,/kaggle/input/audio-files/Audio_Files/j9bhm8OVMQc.wav,371.56,374.039,κράτα,krata
566,/kaggle/input/audio-files/Audio_Files/j9bhm8OVMQc.wav,376.96,379.96,λίγο,ligho
567,/kaggle/input/audio-files/Audio_Files/j9bhm8OVMQc.wav,383.88,390.12,εντάξει εν πονάει επιπόλαιο τραύμα,edaksi em bonai epipoleo travma
568,/kaggle/input/audio-files/Audio_Files/j9bhm8OVMQc.wav,387.68,391.919,είναι σε ευχαριστώ,ine se efcharisto
569,/kaggle/input/audio-files/Audio_Files/j9bhm8OVMQc.wav,390.12,395.68,ευτυχώς που είχες το κινητό στην τσέπη,eftichos pu içes to cinito stin dzepi
570,/kaggle/input/audio-files/Audio_Files/j9bhm8OVMQc.wav,391.919,395.68,σου τζαί όι στην τσάντα μου τζαί καλέσαμε,su dze oɪ stin dzada mu dze kalesame
571,/kaggle/input/audio-files/Audio_Files/j9bhm8OVMQc.wav,397.84,403.12,κλειδαρά ρε αγάπη μου σίγουρα εν θες να,klithara re aghapi mu sighura en thez na
572,/kaggle/input/audio-files/Audio_Files/j9bhm8OVMQc.wav,401.919,406.0,πάμε στην,pame stin
573,/kaggle/input/audio-files/Audio_Files/j9bhm8OVMQc.wav,403.12,408.039,αστυνομία τζαί ήντα έννα έκαναν δύο απλοί,astinomia dze ida ena ekanan thio apli
574,/kaggle/input/audio-files/Audio_Files/j9bhm8OVMQc.wav,406.0,410.72,τσαντάκηδες ήτανε εν ήταν δύο απλοί,tsadacithes itane en itan thio apli
575,/kaggle/input/audio-files/Audio_Files/j9bhm8OVMQc.wav,408.039,413.319,τσαντάκηδες κρατούσαν σουγιά εν σε,tsadacithes kratusan suja en se
576,/kaggle/input/audio-files/Audio_Files/j9bhm8OVMQc.wav,410.72,415.56,καταλαβαίνω ρε μωρού μου αντιστάθηκα γι,katalaveno re moru mu adistathika ji
577,/kaggle/input/audio-files/Audio_Files/j9bhm8OVMQc.wav,413.319,418.319,αυτό τον χρησιμοποίησαν κάθε μέρα,afto ton chrisimopiisaŋ ɡathe mera
578,/kaggle/input/audio-files/Audio_Files/j9bhm8OVMQc.wav,415.56,420.08,συμβαίνουν τέτοια αν πάμε στην αστυνομία,simvenun detia am bame stin astinomia
579,/kaggle/input/audio-files/Audio_Files/j9bhm8OVMQc.wav,418.319,422.8,τζαί η καταγραφή το συμβάν μπορεί να το,dze i kataghrafi to simvan bori na to
580,/kaggle/input/audio-files/Audio_Files/j9bhm8OVMQc.wav,420.08,427.919,μάθει ο σήφης λαόνουμαι άστο,mathi o sifiz laonume asto
581,/kaggle/input/audio-files/Audio_Files/j9bhm8OVMQc.wav,422.8,430.4,καλύτερα εντάξει υποχωρώ προς το,kalitera edaksi ipochoro pros to
582,/kaggle/input/audio-files/Audio_Files/j9bhm8OVMQc.wav,427.919,433.199,παρόν,paron
583,/kaggle/input/audio-files/Audio_Files/j9bhm8OVMQc.wav,430.4,435.24,κοίτα θέλω να σου πω κάτι αλλά εν θέλω,cita thelo na su po kati ala en thelo
584,/kaggle/input/audio-files/Audio_Files/j9bhm8OVMQc.wav,433.199,437.879,να πάθεις,na pathis
585,/kaggle/input/audio-files/Audio_Files/j9bhm8OVMQc.wav,435.24,439.16,υστερία πρέπει να ξεχάσουμε το λονδίνο,isteria prepi na ksechasume to lonthino
586,/kaggle/input/audio-files/Audio_Files/j9bhm8OVMQc.wav,437.879,443.36,τζαί να πάμε στην,dze na pame stin
587,/kaggle/input/audio-files/Audio_Files/j9bhm8OVMQc.wav,439.16,446.639,κύπρο πάλι τα ίδια σε παρακαλώ λαόνουμαι,cipro pali ta ithja se parakalo laonume
588,/kaggle/input/audio-files/Audio_Files/j9bhm8OVMQc.wav,443.36,448.319,το σήφη γιατί να πάμε στην κύπρο γιατί,to sifi jati na pame stiŋ ɡipro jati
589,/kaggle/input/audio-files/Audio_Files/j9bhm8OVMQc.wav,446.639,450.36,θέλω να φτιάξω τη σχέση μου με τον,thelo na ftiakso ti sçesi mu me ton
590,/kaggle/input/audio-files/Audio_Files/j9bhm8OVMQc.wav,448.319,452.24,ματθαίο πέρασε ένα χρόνος μου ελίνα,mattheo perase ena chronoz mu elina
591,/kaggle/input/audio-files/Audio_Files/j9bhm8OVMQc.wav,450.36,454.08,είναι αρφός μου τον αγαπάω καικι απ,ine arfoz mu ton aghapao ceci ap
592,/kaggle/input/audio-files/Audio_Files/j9bhm8OVMQc.wav,452.24,455.919,την άλλη εν μπορώ να σε αφήσω μόνη σου,tin ali en boro na se afiso moni su
593,/kaggle/input/audio-files/Audio_Files/j9bhm8OVMQc.wav,454.08,458.759,στην αθήνα τζαί να φύγω εν πρόκειται να,stin athina dze na figho em brocite na
594,/kaggle/input/audio-files/Audio_Files/j9bhm8OVMQc.wav,455.919,458.759,σε αφήσω πάρ το,se afiso par to
