,audio_filepath,start,end,text,pronunciation
0,/kaggle/input/audio-files/Audio_Files/2xmkiE9R39o.wav,939.0,943.12,αυτή η ίδια τον παρακάλαγε να έσιει επαφή,afti i ithja tom barakalaje na esji epafi
1,/kaggle/input/audio-files/Audio_Files/2xmkiE9R39o.wav,941.12,945.199,με την κόρη του ρε ναι γιατί η μελίνα,me tiŋ ɡori tu re ne jati i melina
2,/kaggle/input/audio-files/Audio_Files/2xmkiE9R39o.wav,943.12,946.88,είναι καλός άνθρωπος ρε τζαί εν θέλει να,ine kalos anthropoz re dze en theli na
3,/kaggle/input/audio-files/Audio_Files/2xmkiE9R39o.wav,945.199,948.759,στερήσει από ένα παιδί τον πατέρα του,sterisi apo ena pethi tom batera tu
4,/kaggle/input/audio-files/Audio_Files/2xmkiE9R39o.wav,946.88,950.68,από την άλλη όμως η ίδια μου το είπε,apo tin ali omos i ithja mu to ipe
5,/kaggle/input/audio-files/Audio_Files/2xmkiE9R39o.wav,948.759,952.16,καθαρά θέλει να είναι με έναν άντρα που,kathara theli na ine me enan adra pu
6,/kaggle/input/audio-files/Audio_Files/2xmkiE9R39o.wav,950.68,954.6,να μην είναι ούτε χωρισμένος ούτε να,na min ine ute chorismenos ute na
7,/kaggle/input/audio-files/Audio_Files/2xmkiE9R39o.wav,952.16,957.44,έσιει παιδί με άλλη άστο βασιλική εν,esji pethi me ali asto vasilici en
8,/kaggle/input/audio-files/Audio_Files/2xmkiE9R39o.wav,954.6,959.56,παραμυθιάζομαι κάτι άλλο,paramithiazome kati alo
9,/kaggle/input/audio-files/Audio_Files/2xmkiE9R39o.wav,957.44,962.68,συμβαίνει λέει,simveni lei
10,/kaggle/input/audio-files/Audio_Files/2xmkiE9R39o.wav,959.56,965.92,αλήθεια λαλώ μηνά σε σένα τουλάχιστον έννα,alithça lalo mina se sena tulaçiston ena
11,/kaggle/input/audio-files/Audio_Files/2xmkiE9R39o.wav,962.68,970.68,το έλεγα σιγά μη μου το,to elegha sigha mi mu to
12,/kaggle/input/audio-files/Audio_Files/2xmkiE9R39o.wav,965.92,970.68,έλεγες έσιει κομένο σου είπα,elejes esji komeno su ipa
13,/kaggle/input/audio-files/Audio_Files/2xmkiE9R39o.wav,981.399,988.92,όι ξέρεις ήντα σκεφτομαι όλη μέρα ήντα ένα,oɪ kseris ida sceftome oli mera ida ena
14,/kaggle/input/audio-files/Audio_Files/2xmkiE9R39o.wav,985.04,992.079,καφέ απ τα χεράκια σου α λοιπόν έννα σου,kafe ap ta çeraca su alfa lipon ena su
15,/kaggle/input/audio-files/Audio_Files/2xmkiE9R39o.wav,988.92,995.04,ικανοποιήσω αυτή σου την επιθυμία σε,ikanopiiso afti su tin epithimia se
16,/kaggle/input/audio-files/Audio_Files/2xmkiE9R39o.wav,992.079,997.36,λεπτά ήντα έμαθα ψάχνεις οικόπεδα για να,lepta ida ematha psachnis ikopetha jana
17,/kaggle/input/audio-files/Audio_Files/2xmkiE9R39o.wav,995.04,999.959,χτίσεις ξενοδοχείο συγγνώμη κιόλας για,chtisis ksenothoçio siŋɡnomi colaz ja
18,/kaggle/input/audio-files/Audio_Files/2xmkiE9R39o.wav,997.36,1002.6,τον ενικό ε έλα μωρέ εδώ κοντεύουμε να,ton eniko epsilon ela more etho kodevume na
19,/kaggle/input/audio-files/Audio_Files/2xmkiE9R39o.wav,999.959,1004.519,γίνουμε κολλητάρια λοιπόν ε λαλώ να κάνω,jinume kolitaria lipon epsilon lalo na kano
20,/kaggle/input/audio-files/Audio_Files/2xmkiE9R39o.wav,1002.6,1007.68,μία ξενοδοχια όξα μονάδα όι ότι εν έσιει,mia ksenothoça oksa monatha oɪ oti en esji
21,/kaggle/input/audio-files/Audio_Files/2xmkiE9R39o.wav,1004.519,1011.24,το μέρος ξενοδοχεία αλλά εγώ ονειρεύομαι,to meros ksenothoçia ala egho onirevome
22,/kaggle/input/audio-files/Audio_Files/2xmkiE9R39o.wav,1007.68,1014.279,κάτι πιο όμορφο πάππαλλα πάντων ε ωραίο,kati pço omorfo papala padon epsilon oreo
23,/kaggle/input/audio-files/Audio_Files/2xmkiE9R39o.wav,1011.24,1016.92,είναι αυτό όταν σταματής να ονειρεύεσαι,ine afto otan stamatiz na onirevese
24,/kaggle/input/audio-files/Audio_Files/2xmkiE9R39o.wav,1014.279,1019.24,κανονικά πρέπει να πεθαίνεις τζαί εδώ,kanonika prepi na pethenis dze etho
25,/kaggle/input/audio-files/Audio_Files/2xmkiE9R39o.wav,1016.92,1021.92,στην κρήτη πρέπει να ονειρευόμαστε διπλα,stiŋ ɡriti prepi na onirevomaste thipla
26,/kaggle/input/audio-files/Audio_Files/2xmkiE9R39o.wav,1019.24,1024.36,γιατί ο τόπος μας μωρέ είναι ευλογημένος,jati o topoz maz more ine evlojimenos
27,/kaggle/input/audio-files/Audio_Files/2xmkiE9R39o.wav,1021.92,1026.28,τζαί έννα δεις ότι η κρήτη έννα σηκώσει,dze ena this oti i kriti ena sikosi
28,/kaggle/input/audio-files/Audio_Files/2xmkiE9R39o.wav,1024.36,1028.12,κκελλέ γρηγορότερα από όλη την ελλάδα το,cele ghrighoroter apo oli tin elatha to
29,/kaggle/input/audio-files/Audio_Files/2xmkiE9R39o.wav,1026.28,1030.52,λαλώ εγώ η κωνσταντίνα πάντως εμένα εν,lalo egho i konstadina pados emena en
30,/kaggle/input/audio-files/Audio_Files/2xmkiE9R39o.wav,1028.12,1033.76,μου φαίνεσαι για κριτικά εν είμαι από,mu fenese ja kritika en ime apo
31,/kaggle/input/audio-files/Audio_Files/2xmkiE9R39o.wav,1030.52,1037.079,επιλογή έγινα τόσα χρόνια εδώ τη λάτρεψα,epiloji ejina tosa chronya etho ti latrepsa
32,/kaggle/input/audio-files/Audio_Files/2xmkiE9R39o.wav,1033.76,1040.959,την κρήτη εσύ θεσσαλονικιός γέννημα,tiŋ ɡriti esi thessalonicoz jenima
33,/kaggle/input/audio-files/Audio_Files/2xmkiE9R39o.wav,1037.079,1043.72,θρέμα μπαμ κάνει έχετε άλλο αέρα εσείς,threma bam kani eçete alo aera esis
34,/kaggle/input/audio-files/Audio_Files/2xmkiE9R39o.wav,1040.959,1046.24,τη θεσσαλονική σας έτσι έχετε άλλη,ti thessalonici sas etsi eçete ali
35,/kaggle/input/audio-files/Audio_Files/2xmkiE9R39o.wav,1043.72,1051.72,γοητεία είσαστε πιο κοσμοπολίτες,ghoɪtia isaste pço kosmopolites
36,/kaggle/input/audio-files/Audio_Files/2xmkiE9R39o.wav,1046.24,1054.799,εν μου λες παντρεμένος μπα όι ποτέ,en mu les padremenoz ba oɪ pote
37,/kaggle/input/audio-files/Audio_Files/2xmkiE9R39o.wav,1051.72,1057.88,ευτυχώς ποτέ ευτυχώς,eftichos pote eftichos
38,/kaggle/input/audio-files/Audio_Files/2xmkiE9R39o.wav,1054.799,1060.559,ακούω αυτό τώρα όξα σημαίνει ότι έχεις,akuo afto tora oksa simeni oti eçis
39,/kaggle/input/audio-files/Audio_Files/2xmkiE9R39o.wav,1057.88,1064.4,απογοητευτεί πάρα πολύ όξα ότι εν έχεις,apoghoɪtefti para poli oksa oti en eçis
40,/kaggle/input/audio-files/Audio_Files/2xmkiE9R39o.wav,1060.559,1067.36,αγαπήσει ποτέ αληθινά μάλλον το δεύτερο,aghapisi pote alithina malon do theftero
41,/kaggle/input/audio-files/Audio_Files/2xmkiE9R39o.wav,1064.4,1069.48,κωνσταντινα μάλιστα μη νομίζεις τώρα ότι,konstadina malista mi nomizis tora oti
42,/kaggle/input/audio-files/Audio_Files/2xmkiE9R39o.wav,1067.36,1071.799,σου κάνω ανάκριση η κουβέντα να γίνεται,su kano anakrisi i kuveda na jinete
43,/kaggle/input/audio-files/Audio_Files/2xmkiE9R39o.wav,1069.48,1074.48,έλα εν παρεξηγούμαι να σου πω ο,ela em bareksighume na su po omikron
44,/kaggle/input/audio-files/Audio_Files/2xmkiE9R39o.wav,1071.799,1076.799,διαμαντής τζαί η φίλοι σου η δάφνη η,thiamadis dze i fili su i thafni ita
45,/kaggle/input/audio-files/Audio_Files/2xmkiE9R39o.wav,1074.48,1078.559,δάφνη ναι έχουνε φύγει για κύπρο τζαί,thafni ne echune fiji ja cipro dze
46,/kaggle/input/audio-files/Audio_Files/2xmkiE9R39o.wav,1076.799,1080.52,έσιει προκύψει μια ευκαιρία με ένα κότο,esji procipsi mnya efceria me ena koto
47,/kaggle/input/audio-files/Audio_Files/2xmkiE9R39o.wav,1078.559,1082.559,κθ θέλω να μεσολαβήσει ε έννα χουνε,kapathita thelo na mesolavisi epsilon ena chune
48,/kaggle/input/audio-files/Audio_Files/2xmkiE9R39o.wav,1080.52,1084.88,προσγειωθεί τώρα ναι αλλά το μένο τζαί,prosjothi tora ne ala to meno dze
49,/kaggle/input/audio-files/Audio_Files/2xmkiE9R39o.wav,1082.559,1087.039,εν απαντάει στο τηλέφωνο τζαί σκέφτηκα,en apadai sto tilefono dze sceftika
50,/kaggle/input/audio-files/Audio_Files/2xmkiE9R39o.wav,1084.88,1089.039,αλόπως έννα μπορούσα να ενοχλήσω στο κινητό,alopos ena borusa na enochliso sto cinito
51,/kaggle/input/audio-files/Audio_Files/2xmkiE9R39o.wav,1087.039,1090.84,της κυρίας δάφνης ναι καλέ πάρ τη δάφνη,tis ciriaz thafniz ne kale par ti thafni
52,/kaggle/input/audio-files/Audio_Files/2xmkiE9R39o.wav,1089.039,1093.76,είναι πολύ άνετη α ωραία μως να μου,ine poli aneti alfa orea moz na mu
53,/kaggle/input/audio-files/Audio_Files/2xmkiE9R39o.wav,1090.84,1098.28,δώσει το τηλέφωνό της α,thosi to tilefono tis alfa
54,/kaggle/input/audio-files/Audio_Files/2xmkiE9R39o.wav,1093.76,1101.72,ε δως μου το τηλέφωνό σου για να σου,epsilon thoz mu to tilefono su jana su
55,/kaggle/input/audio-files/Audio_Files/2xmkiE9R39o.wav,1098.28,1101.72,προωθήσω το τηλέφωνο της,proothiso to tilefono tis
56,/kaggle/input/audio-files/Audio_Files/2xmkiE9R39o.wav,1106.96,1110.76,δάφνης αρ,thafnis ar
57,/kaggle/input/audio-files/Audio_Files/2xmkiE9R39o.wav,1112.84,1121.24,ωραία τώρα λοιπόν το χεις τη στάθμης,orea tora lipon do çis ti stathmis
58,/kaggle/input/audio-files/Audio_Files/2xmkiE9R39o.wav,1116.4,1121.24,ευχαριστώ πολύ πάω για τον καφέ που,efcharisto poli pao ja toŋ ɡafe pu
59,/kaggle/input/audio-files/Audio_Files/2xmkiE9R39o.wav,1123.2,1128.28,λέει πάντως αν κάποιος ήθελε να κάνει,lei pados aŋ ɡapios ithele na kani
60,/kaggle/input/audio-files/Audio_Files/2xmkiE9R39o.wav,1126.559,1130.52,ζημιά έννα έπρεπε να είχε πρόσβαση στο,zimia ena eprepe na içe prosvasi sto
61,/kaggle/input/audio-files/Audio_Files/2xmkiE9R39o.wav,1128.28,1134.32,κελλάρι τζαί ο χώρος εννεν ξέφραγο,celari dze o choros eneŋ ɡzefragho
62,/kaggle/input/audio-files/Audio_Files/2xmkiE9R39o.wav,1130.52,1137.12,αμπέλι έσιει συναγερμό πώς το έκανε,abeli esji sinajermo pos to ekane
63,/kaggle/input/audio-files/Audio_Files/2xmkiE9R39o.wav,1134.32,1140.679,μπορεί κάποιος εύκολα να βρει τον κωδικό,bori kapios efkola na vri toŋ ɡothiko
64,/kaggle/input/audio-files/Audio_Files/2xmkiE9R39o.wav,1137.12,1141.799,όι βέβαια μόνο εμείς τον γνωρίζουμε τον,oɪ vevea mono emis ton ghnorizume ton
65,/kaggle/input/audio-files/Audio_Files/2xmkiE9R39o.wav,1140.679,1145.28,έχετε κάπου,eçete kapu
66,/kaggle/input/audio-files/Audio_Files/2xmkiE9R39o.wav,1141.799,1147.76,γραμμένο ναι βέβαια άνθρωποι είμαστε,ghrameno ne veve anthropi imaste
67,/kaggle/input/audio-files/Audio_Files/2xmkiE9R39o.wav,1145.28,1150.28,μπορεί να ξεχάσουμε είναι γραμμένο σε,bori na ksechasume ine ghrameno se
68,/kaggle/input/audio-files/Audio_Files/2xmkiE9R39o.wav,1147.76,1154.36,ένα χαρτί στο γραφείο του σπιτιού μας οι,ena charti sto ghrafio tu spitiu mas i
69,/kaggle/input/audio-files/Audio_Files/2xmkiE9R39o.wav,1150.28,1158.0,γιαννακάκη δες βρέθηκαν ποτέ,janakaci thez vrethikam bote
70,/kaggle/input/audio-files/Audio_Files/2xmkiE9R39o.wav,1154.36,1159.48,τζιαμέ ναι τη μέρα που υπογράφαμε τα,dziame ne ti mera pu ipoghrafame ta
71,/kaggle/input/audio-files/Audio_Files/2xmkiE9R39o.wav,1158.0,1162.799,συμβόλαια για την,simvolea ja tin
72,/kaggle/input/audio-files/Audio_Files/2xmkiE9R39o.wav,1159.48,1165.72,εταιρεία λοιπόν επειδή εν ξέρουμε τζαί,eteria lipon epithi eŋ ɡzerume dze
73,/kaggle/input/audio-files/Audio_Files/2xmkiE9R39o.wav,1162.799,1169.24,εν είμαστε σίγουροι άστε το έννα μιλήσω,en imaste sighuri aste to ena miliso
74,/kaggle/input/audio-files/Audio_Files/2xmkiE9R39o.wav,1165.72,1171.559,με το διαμαντή τζαί έννα δούμε αντιδράσεις,me to thiamadi dze ena thume adithrasis
75,/kaggle/input/audio-files/Audio_Files/2xmkiE9R39o.wav,1169.24,1173.679,εγώ λαλώ να καλέσουμε τη σμαση να ρθει να,egho lalo na kalesume ti smasi na rthi na
76,/kaggle/input/audio-files/Audio_Files/2xmkiE9R39o.wav,1171.559,1176.2,πάρει αποτυπώματα έννα υπάρχουν τα,pari apotipomata ena iparchun da
77,/kaggle/input/audio-files/Audio_Files/2xmkiE9R39o.wav,1173.679,1180.12,αποτυπώματα όλων μας χθες έγινε γιορτή,apotipomata olon mas chthes ejine jorti
78,/kaggle/input/audio-files/Audio_Files/2xmkiE9R39o.wav,1176.2,1181.52,εδώ μέσα ε ναι ρε παιδί μου βέβαια εμείς,etho mesa epsilon ne re pethi mu vevea emis
79,/kaggle/input/audio-files/Audio_Files/2xmkiE9R39o.wav,1180.12,1184.76,έννα εξαιρεθούν,ena ekserethun
80,/kaggle/input/audio-files/Audio_Files/2xmkiE9R39o.wav,1181.52,1188.44,αλλά άστε το να μιλήσουμε τζαί με το,al aste to na milisume dze me to
81,/kaggle/input/audio-files/Audio_Files/2xmkiE9R39o.wav,1184.76,1188.44,διαμαντή κκαι βλέπουμε,thiamadi ce vlepume
82,/kaggle/input/audio-files/Audio_Files/2xmkiE9R39o.wav,1209.159,1215.36,ήντα,ida
83,/kaggle/input/audio-files/Audio_Files/2xmkiE9R39o.wav,1210.28,1217.559,έγινε ήντα έμαθες βλακείες της την έδωσε,ejine ida emathez vlacies tis tin ethose
84,/kaggle/input/audio-files/Audio_Files/2xmkiE9R39o.wav,1215.36,1219.799,τζαί καλά το θέμα του παιδιού θέλει λέει,dze kala to thema tu pethiu theli lei
85,/kaggle/input/audio-files/Audio_Files/2xmkiE9R39o.wav,1217.559,1222.08,έναν άντρα ελεύθερο χωρίς υποχρεώσεις,enan adra elefthero choris ipochreosis
86,/kaggle/input/audio-files/Audio_Files/2xmkiE9R39o.wav,1219.799,1223.2,τζαί τα πιστεύεις τώρα εσύ αυτά ξέρω τζαί,dze ta pistevis tora esi afta ksero dze
87,/kaggle/input/audio-files/Audio_Files/2xmkiE9R39o.wav,1222.08,1226.24,εγώ ήντα να,egho ida na
88,/kaggle/input/audio-files/Audio_Files/2xmkiE9R39o.wav,1223.2,1229.2,πιστέψω με τους γονείς της μίλησες,pistepso me tuz ghonis tiz milises
89,/kaggle/input/audio-files/Audio_Files/2xmkiE9R39o.wav,1226.24,1231.159,μίλησα με τη μάνα της τους είπε ότι,milisa me ti mana tis tus ipe oti
90,/kaggle/input/audio-files/Audio_Files/2xmkiE9R39o.wav,1229.2,1232.96,θέλει να χωρίσει τζαί ότι εν θέλει να,theli na chorisi dze oti en theli na
91,/kaggle/input/audio-files/Audio_Files/2xmkiE9R39o.wav,1231.159,1236.039,πάει στο πατρικό της γιατί ξέρει ότι έννα,pai sto patriko tiz jati kseri oti ena
92,/kaggle/input/audio-files/Audio_Files/2xmkiE9R39o.wav,1232.96,1237.76,εμφανιστώ τζαί έννα τη βρω εν το πιστεύω,emfanisto dze ena ti vro en do pistevo
93,/kaggle/input/audio-files/Audio_Files/2xmkiE9R39o.wav,1236.039,1240.0,ήντα μας κοροϊδεύουμε στα μούτρα μας,ida mas koroɪthevume sta mutra mas
94,/kaggle/input/audio-files/Audio_Files/2xmkiE9R39o.wav,1237.76,1241.64,συμπέθερο καλύτερα να μην ξέρουνε λέει,sibethero kalitera na miŋ ɡzerune lei
95,/kaggle/input/audio-files/Audio_Files/2xmkiE9R39o.wav,1240.0,1243.919,για να μη μου το πουν έτσι τζαί τους,jana mi mu to pun etsi dze tus
96,/kaggle/input/audio-files/Audio_Files/2xmkiE9R39o.wav,1241.64,1245.88,πιέσω τζαί μετά άρπαξε ο πατέρας της το,pçeso dze meta arpakse o pateras tis to
97,/kaggle/input/audio-files/Audio_Files/2xmkiE9R39o.wav,1243.919,1247.64,ακουστικό τζαί με άρχισε στο κήρυγμα,akustiko dze me arçise sto cirighma
98,/kaggle/input/audio-files/Audio_Files/2xmkiE9R39o.wav,1245.88,1250.88,γιατί εν τους είπα για το παιδί τζαί εν,jati en dus ipa ja to pethi dze en
99,/kaggle/input/audio-files/Audio_Files/2xmkiE9R39o.wav,1247.64,1250.88,πάνε τζιαμέ στο διάολο κι,pane dziame sto thiaolo ci
100,/kaggle/input/audio-files/Audio_Files/2xmkiE9R39o.wav,1254.24,1259.559,αυτοί ο νεκτάριος δε μιλιέται από τη,afti o nektarioz the miʎete apo ti
101,/kaggle/input/audio-files/Audio_Files/2xmkiE9R39o.wav,1257.08,1262.64,στενοχωρεί του τζαί εν ξέρω τζαί ήντα να,stenochori tu dze eŋ ɡzero dze ida na
102,/kaggle/input/audio-files/Audio_Files/2xmkiE9R39o.wav,1259.559,1265.44,του πω όπως τζαί να χει η καταστροφή,tu po opos dze na çi i katastrofi
103,/kaggle/input/audio-files/Audio_Files/2xmkiE9R39o.wav,1262.64,1267.919,είναι μεγάλη ο αχχιλέας έτσι κιι άλλωσπως,ine meghali o achçileas etsi ci alospos
104,/kaggle/input/audio-files/Audio_Files/2xmkiE9R39o.wav,1265.44,1270.24,εν μιλιόταν οπότε εν κατάλαβα τζαί,en miʎotan opote eŋ ɡatalava dze
105,/kaggle/input/audio-files/Audio_Files/2xmkiE9R39o.wav,1267.919,1270.24,καμία,kamia
106,/kaggle/input/audio-files/Audio_Files/2xmkiE9R39o.wav,1270.6,1276.48,διαφορά καλώς,thiafora kalos
107,/kaggle/input/audio-files/Audio_Files/2xmkiE9R39o.wav,1273.08,1278.72,τον σε κουρασμένος αγάπη μου όι εντάξει,ton se kurasmenos aghapi mu oɪ edaksi
108,/kaggle/input/audio-files/Audio_Files/2xmkiE9R39o.wav,1276.48,1280.72,υπάρχει φαγί απόψε έννα έρθει ο νικολάου,iparçi faji apopse ena erthi o nikolau
109,/kaggle/input/audio-files/Audio_Files/2xmkiE9R39o.wav,1278.72,1283.4,με τη γυναίκα του ναι αγάπη μου εγώ έννα,me ti jineka tu ne aghapi mu egho ena
110,/kaggle/input/audio-files/Audio_Files/2xmkiE9R39o.wav,1280.72,1284.96,μαγειρέψω έννα βοηθήσω κιι εγώ εν κάνει,majirepso ena voɪthiso ci egho eŋ ɡani
111,/kaggle/input/audio-files/Audio_Files/2xmkiE9R39o.wav,1283.4,1288.039,να κουράζεται στην κατάστασή της η,na kurazete stiŋ ɡatastasi tis ita
112,/kaggle/input/audio-files/Audio_Files/2xmkiE9R39o.wav,1284.96,1289.88,δήμητρα εμένα ξεχάστε με έχω τα δικά μου,thimitra emena ksechaste me echo ta thika mu
113,/kaggle/input/audio-files/Audio_Files/2xmkiE9R39o.wav,1288.039,1291.44,δε μπορώ να συμμετέχω σε αυτό το,the boro na simetecho se afto to
114,/kaggle/input/audio-files/Audio_Files/2xmkiE9R39o.wav,1289.88,1293.279,πανηγύρι πρέπει κανα πανηγύρι εδώ,panijiri prepi kana panijiri etho
115,/kaggle/input/audio-files/Audio_Files/2xmkiE9R39o.wav,1291.44,1295.72,ευρυδίκη γιατί εμείς εδώ καιγόμαστε,evrithici jati emis etho ceghomaste
116,/kaggle/input/audio-files/Audio_Files/2xmkiE9R39o.wav,1293.279,1298.36,ξέρεις ναι τζαί εγώ καίγομαι αλλά δε,kseriz ne dze egho ceghome ala the
117,/kaggle/input/audio-files/Audio_Files/2xmkiE9R39o.wav,1295.72,1299.96,νοιάζεται κανένας,nyazete kanenas
118,/kaggle/input/audio-files/Audio_Files/2xmkiE9R39o.wav,1298.36,1304.039,σας,sas
119,/kaggle/input/audio-files/Audio_Files/2xmkiE9R39o.wav,1299.96,1305.64,ηρέμησα κάτσε μην την παρεξηγείς ξέρεις,iremisa katse min dim bareksijis kseris
120,/kaggle/input/audio-files/Audio_Files/2xmkiE9R39o.wav,1304.039,1308.919,ότι είναι πολύ,oti ine poli
121,/kaggle/input/audio-files/Audio_Files/2xmkiE9R39o.wav,1305.64,1311.84,αναστατωμένη λοιπόν χριστινος με,anastatomeni lipon christinoz me
122,/kaggle/input/audio-files/Audio_Files/2xmkiE9R39o.wav,1308.919,1314.08,βοηθήσεις έννα βοηθήσω εγώ έννα πάρω τη,voɪthisis ena voɪthiso egho ena paro ti
123,/kaggle/input/audio-files/Audio_Files/2xmkiE9R39o.wav,1311.84,1315.84,χριστίνα στη στετέ τζαί έννα φωνάξω την,christina sti stete dze ena fonakso tin
124,/kaggle/input/audio-files/Audio_Files/2xmkiE9R39o.wav,1314.08,1317.679,κυρία ελευθερία ππου καρτζί ξέρει να,ciria eleftheria pu kardzi kseri na
125,/kaggle/input/audio-files/Audio_Files/2xmkiE9R39o.wav,1315.84,1319.039,κάνει φοβερές πίτες κι εγώ ξέρω να κάνω,kani foveres pites ci egho ksero na kano
126,/kaggle/input/audio-files/Audio_Files/2xmkiE9R39o.wav,1317.679,1321.96,πολύ ωραίες πίτες,poli orees pites
127,/kaggle/input/audio-files/Audio_Files/2xmkiE9R39o.wav,1319.039,1324.799,κι εγώ προτιμώ με τη χριστίνα,ci egho protimo me ti christina
128,/kaggle/input/audio-files/Audio_Files/2xmkiE9R39o.wav,1321.96,1327.4,λοιπόν αγάπη μου ήντα να μαγειρέψω ξέρεις,lipon aghapi mu ida na majirepso kseris
129,/kaggle/input/audio-files/Audio_Files/2xmkiE9R39o.wav,1324.799,1329.919,αν έχουν κάποια προτίμηση εν έχω ιδέα,an echuŋ ɡapia protimisi en echo ithea
130,/kaggle/input/audio-files/Audio_Files/2xmkiE9R39o.wav,1327.4,1331.799,φτιάξει τζαί κάτι καλό όμως μη νομίζουν,ftiaksi dze kati kalo omoz mi nomizun
131,/kaggle/input/audio-files/Audio_Files/2xmkiE9R39o.wav,1329.919,1336.4,ότι εν θέλουμε να τους περιβ ούμε,oti en thelume na tus periv ume
132,/kaggle/input/audio-files/Audio_Files/2xmkiE9R39o.wav,1331.799,1336.4,συνέβησαν πολλά τώρα τελευταία,sinevisam bola tora teleftea
133,/kaggle/input/audio-files/Audio_Files/2xmkiE9R39o.wav,1379.48,1386.08,θέλω να τους αποτελειώσουν τους ματθαίος,thelo na tus apoteʎosun duz mattheos
134,/kaggle/input/audio-files/Audio_Files/2xmkiE9R39o.wav,1382.0,1386.08,να σβηστούν απ το χάρτη,na svistun ap to charti
135,/kaggle/input/audio-files/Audio_Files/2xmkiE9R39o.wav,1442.0,1445.76,έννα έχω μιλήσει με το δικηγόρο μου παιδιά,ena echo milisi me to thicighoro mu pethia
136,/kaggle/input/audio-files/Audio_Files/2xmkiE9R39o.wav,1444.039,1446.799,ο άνθρωπος στα εταιρικά εν πιάνεται,o anthropos sta eterika em bçanete
137,/kaggle/input/audio-files/Audio_Files/2xmkiE9R39o.wav,1445.76,1450.48,είναι,ine
138,/kaggle/input/audio-files/Audio_Files/2xmkiE9R39o.wav,1446.799,1452.36,τσακάλι δηλαδή πώς ακριβώς έννα το κάνουμε,tsakali thilathi pos akrivos ena to kanume
139,/kaggle/input/audio-files/Audio_Files/2xmkiE9R39o.wav,1450.48,1454.0,ο δικηγόρος μου έννα αναλάβει να συστήσει,o thicighoroz mu en analavi na sistisi
140,/kaggle/input/audio-files/Audio_Files/2xmkiE9R39o.wav,1452.36,1456.76,μία εταιρεία για λογαριασμό σας με έδρα,mia eteria ja loghariasmo saz me ethra
141,/kaggle/input/audio-files/Audio_Files/2xmkiE9R39o.wav,1454.0,1458.919,το έννα βάλει ένα διαχειριστή,to ena vali ena thiaçiristi
142,/kaggle/input/audio-files/Audio_Files/2xmkiE9R39o.wav,1456.76,1460.679,τζαί εσείς εν έννα φαίνεστε καθόλου στη,dze esis en ena feneste katholu sti
143,/kaggle/input/audio-files/Audio_Files/2xmkiE9R39o.wav,1458.919,1463.32,συνέχεια η εταιρεία έννα μεταφερθεί στην,sineça i eteria ena metaferthi stin
144,/kaggle/input/audio-files/Audio_Files/2xmkiE9R39o.wav,1460.679,1465.24,ελλάδα εδώ στην κρήτη τζαί έννα συνεργαστεί,elatha etho stiŋ ɡriti dze ena sinerghasti
145,/kaggle/input/audio-files/Audio_Files/2xmkiE9R39o.wav,1463.32,1466.84,μαζί μου κ έτσι εν έννα φαίνεται ότι,mazi mu kapa etsi en ena fenete oti
146,/kaggle/input/audio-files/Audio_Files/2xmkiE9R39o.wav,1465.24,1468.64,εμείς είμαστε συνέταιροι καικι έτσι ο,emis imaste sineteri ceci etsi omikron
147,/kaggle/input/audio-files/Audio_Files/2xmkiE9R39o.wav,1466.84,1471.44,μάρκος έννα φαίνεται προς τα έξω σαν είναι,markos ena fenete pros ta ekso san ine
148,/kaggle/input/audio-files/Audio_Files/2xmkiE9R39o.wav,1468.64,1473.88,ο παραγωγός τζαί ταυτόχρονα έννα λειτουργεί,o paraghoghos dze taftochrona ena liturji
149,/kaggle/input/audio-files/Audio_Files/2xmkiE9R39o.wav,1471.44,1476.559,τζαί η δική μας εταιρεία με τον θείο έτσι,dze i thici mas eteria me ton thio etsi
