,audio_filepath,start,end,text,pronunciation
595,/kaggle/input/audio-files/Audio_Files/j9bhm8OVMQc.wav,464.52,469.12,απόφαση όι νεκτάριε εν έπρεπε να,apofasi oɪ nektarie en eprepe na
596,/kaggle/input/audio-files/Audio_Files/j9bhm8OVMQc.wav,467.159,471.479,στείλεις τη χριστίνα τώρα να ειδοποιήσει,stilis ti christina tora na ithopiisi
597,/kaggle/input/audio-files/Audio_Files/j9bhm8OVMQc.wav,469.12,474.199,τη στετέ νυχτιάτικα να αναστατωθεί,ti stete nichtiatika n anastatothi
598,/kaggle/input/audio-files/Audio_Files/j9bhm8OVMQc.wav,471.479,476.28,κιόλας επειδή απλά ήθελες να μάθει για,colas epithi apla ithelez na mathi ja
599,/kaggle/input/audio-files/Audio_Files/j9bhm8OVMQc.wav,474.199,478.879,τον πυροβολισμό άς την αύριο να,tom birovolismo as tin avrio na
600,/kaggle/input/audio-files/Audio_Files/j9bhm8OVMQc.wav,476.28,480.72,ξημερώσει εν μπορούσα να της το κρύψω,ksimerosi en borusa na tis to kripso
601,/kaggle/input/audio-files/Audio_Files/j9bhm8OVMQc.wav,478.879,482.68,ρε ματθαίο,re mattheo
602,/kaggle/input/audio-files/Audio_Files/j9bhm8OVMQc.wav,480.72,486.639,πάω,pao
603,/kaggle/input/audio-files/Audio_Files/j9bhm8OVMQc.wav,482.68,489.84,πάνω πρέπει να ταΐσω το μωρό,pano prepi na taiso to moro
604,/kaggle/input/audio-files/Audio_Files/j9bhm8OVMQc.wav,486.639,493.84,μου είμαι τζαί,mu ime dze
605,/kaggle/input/audio-files/Audio_Files/j9bhm8OVMQc.wav,489.84,497.24,πτώμα πείτε στη στετέ ότι,ptoma pite sti stete oti
606,/kaggle/input/audio-files/Audio_Files/j9bhm8OVMQc.wav,493.84,499.68,κοιμήθηκα έννα έρθω κι εγώ μαζί σου άσε τη,cimithika ena ertho ci egho mazi su ase ti
607,/kaggle/input/audio-files/Audio_Files/j9bhm8OVMQc.wav,497.24,502.0,μαμά ήσυχη άσε να,mama isiçi ase na
608,/kaggle/input/audio-files/Audio_Files/j9bhm8OVMQc.wav,499.68,506.08,ξεκουραστεί έλα να πάμε πάνω να σου,ksekurasti ela na pame pano na su
609,/kaggle/input/audio-files/Audio_Files/j9bhm8OVMQc.wav,502.0,510.24,διαβάσω ένα παραμύθι εν θέλω μαζί σου,thiavaso ena paramithi en thelo mazi su
610,/kaggle/input/audio-files/Audio_Files/j9bhm8OVMQc.wav,506.08,513.12,μαρίνα ήντα εν θέλεις γιατί ήντα είπες τώρα,marina ida en theliz jati ida ipes tora
611,/kaggle/input/audio-files/Audio_Files/j9bhm8OVMQc.wav,510.24,516.08,αυτό πάω στο δωμάτιό μου να κάνω μόνη,afto pao sto thomatio mu na kano moni
612,/kaggle/input/audio-files/Audio_Files/j9bhm8OVMQc.wav,513.12,516.08,μου μπάνιο,mu banyo
613,/kaggle/input/audio-files/Audio_Files/j9bhm8OVMQc.wav,516.56,523.9590000000001,μπορώ ζηλεύει το μωρό τζαί είναι,boro zilevi to moro dze ine
614,/kaggle/input/audio-files/Audio_Files/j9bhm8OVMQc.wav,520.9590000000001,523.9590000000001,εκνευρισμένη,eknevrismeni
615,/kaggle/input/audio-files/Audio_Files/j9bhm8OVMQc.wav,525.8389999999999,531.279,λογικό θέλω να πάω στο σταύλο να δω τα,lojiko thelo na pao sto stavlo na tho ta
616,/kaggle/input/audio-files/Audio_Files/j9bhm8OVMQc.wav,528.64,534.399,άλογα μου αγάπη μου έχεις τρελαθεί,alogha mu aghapi mu eçis trelathi
617,/kaggle/input/audio-files/Audio_Files/j9bhm8OVMQc.wav,531.279,537.04,νυχτιάτικα εν γίνεται αυτό μπορεί,nichtiatika en jinete afto bori
618,/kaggle/input/audio-files/Audio_Files/j9bhm8OVMQc.wav,534.399,539.92,κάποιος να τα,kapioz na ta
619,/kaggle/input/audio-files/Audio_Files/j9bhm8OVMQc.wav,537.04,541.44,σκότωσε έλα μαρίνα μου πήγαινε να,skotose ela marina mu pijene na
620,/kaggle/input/audio-files/Audio_Files/j9bhm8OVMQc.wav,539.92,544.44,κοιμηθείς αγάπη μου τζαί κανείς εν,cimithis aghapi mu dze kanis en
621,/kaggle/input/audio-files/Audio_Files/j9bhm8OVMQc.wav,541.44,547.959,σκοτώνει τα λογά σου άντε κόρη μου,skotoni ta logha su ade kori mu
622,/kaggle/input/audio-files/Audio_Files/j9bhm8OVMQc.wav,544.44,551.8,από φαντασία το παιδί σας σκίζει,apo fadasia to pethi sas scizi
623,/kaggle/input/audio-files/Audio_Files/j9bhm8OVMQc.wav,547.959,551.8,πάντως έλα να πάμε,pados ela na pame
624,/kaggle/input/audio-files/Audio_Files/j9bhm8OVMQc.wav,554.44,559.12,πάνω ποιο παραμυθάκι θες να σου,pano pio paramithaci thez na su
625,/kaggle/input/audio-files/Audio_Files/j9bhm8OVMQc.wav,566.04,572.399,διαβάσω σας την,thiavaso sas tin
626,/kaggle/input/audio-files/Audio_Files/j9bhm8OVMQc.wav,568.36,578.0,έφερα μα,efera ma
627,/kaggle/input/audio-files/Audio_Files/j9bhm8OVMQc.wav,572.399,580.2,μαθο είσαι καλά γιόκα μου πες μου είσαι,matho ise kala joka mu pez mu ise
628,/kaggle/input/audio-files/Audio_Files/j9bhm8OVMQc.wav,578.0,583.0,καλά ήντα είναι,kala ida ine
629,/kaggle/input/audio-files/Audio_Files/j9bhm8OVMQc.wav,580.2,584.36,αυτό μη μου πεις ότι σω το κανε η,afto mi mu pis oti so to kane ita
630,/kaggle/input/audio-files/Audio_Files/j9bhm8OVMQc.wav,583.0,586.68,καταραμένη,katarameni
631,/kaggle/input/audio-files/Audio_Files/j9bhm8OVMQc.wav,584.36,591.519,αναστασία ε,anastasia epsilon
632,/kaggle/input/audio-files/Audio_Files/j9bhm8OVMQc.wav,586.68,591.519,μου α μου,mu alfa mu
633,/kaggle/input/audio-files/Audio_Files/j9bhm8OVMQc.wav,605.24,609.48,έλα μια ρακή τζαί πας μετά για ύπνο μην,ela mnya raci dze paz meta ja ipno min
634,/kaggle/input/audio-files/Audio_Files/j9bhm8OVMQc.wav,607.88,612.12,αποφεύγεις την,apofevjis tin
635,/kaggle/input/audio-files/Audio_Files/j9bhm8OVMQc.wav,609.48,615.279,κουβέντα για την κόρη σου μιλούσαμε πριν,kuveda ja tiŋ ɡori su milusame prin
636,/kaggle/input/audio-files/Audio_Files/j9bhm8OVMQc.wav,612.12,617.36,έρθει ο μάρκος να μας διακόψει αναστασία,erthi o markoz na maz thiakopsi anastasia
637,/kaggle/input/audio-files/Audio_Files/j9bhm8OVMQc.wav,615.279,623.16,με πιέζεις,me pçezis
638,/kaggle/input/audio-files/Audio_Files/j9bhm8OVMQc.wav,617.36,625.32,πολύ ρε συ νέμα σου είναι η κόρη σου,poli re si nema su ine i kori su
639,/kaggle/input/audio-files/Audio_Files/j9bhm8OVMQc.wav,623.16,627.8,ξέρει είναι πληγωμένη χρειάζεται τον,kseri ine plighomeni chrçazete ton
640,/kaggle/input/audio-files/Audio_Files/j9bhm8OVMQc.wav,625.32,630.72,πατέρα της στο πρότυπο του πατέρα,patera tis sto protipo tu patera
641,/kaggle/input/audio-files/Audio_Files/j9bhm8OVMQc.wav,627.8,633.079,της γιατί ήντα αντιστέκεσαι αφού ξέρω ότι,tiz jati id adistecese afu ksero oti
642,/kaggle/input/audio-files/Audio_Files/j9bhm8OVMQc.wav,630.72,635.32,κατά βάθος θέλεις εξαιτίας αυτού του,kata vathos thelis eksetias aftu tu
643,/kaggle/input/audio-files/Audio_Files/j9bhm8OVMQc.wav,633.079,638.0,παιδιού έφυγε η μελίνα όξα τουλάχιστον,pethiu efije i melina oksa tulaçiston
644,/kaggle/input/audio-files/Audio_Files/j9bhm8OVMQc.wav,635.32,640.12,αυτό ισχυρίζεται αν εν ξεκαθαρίσω,afto isçirizete an eŋ ɡzekathariso
645,/kaggle/input/audio-files/Audio_Files/j9bhm8OVMQc.wav,638.0,643.8,λοιπόν με τη μελίνα εν θέλω να ανοίξω,lipon me ti melina en thelo n anikso
646,/kaggle/input/audio-files/Audio_Files/j9bhm8OVMQc.wav,640.12,646.48,παρτίδες με τη μικρή τη μελίνα ξέχασέ τη,partithez me ti mikri ti melina ksechase ti
647,/kaggle/input/audio-files/Audio_Files/j9bhm8OVMQc.wav,643.8,649.8389999999999,έσιει τελειώσει τίποτα εν έσιει τελειώσει,esji teʎosi tipota en esji teʎosi
648,/kaggle/input/audio-files/Audio_Files/j9bhm8OVMQc.wav,646.48,653.44,σήφη ξε κόλλα δε θέλω να χεις την τύχη,sifi kse kola the thelo na çis tin diçi
649,/kaggle/input/audio-files/Audio_Files/j9bhm8OVMQc.wav,649.8389999999999,655.76,μου το παραδέχεσαι λοιπόν ζ ακόμα,mu to paratheçese lipon zit akoma
650,/kaggle/input/audio-files/Audio_Files/j9bhm8OVMQc.wav,653.44,660.0,κολλημένη με αυτό το,kolimeni me afto to
651,/kaggle/input/audio-files/Audio_Files/j9bhm8OVMQc.wav,655.76,663.72,βλάκα ναι ποτέ εν ξεπέρασα το ματθαίο,vlaka ne pote eŋ ɡzeperasa to mattheo
652,/kaggle/input/audio-files/Audio_Files/j9bhm8OVMQc.wav,660.0,665.72,ποτέ άλλο το ένα κι άλλο το άλλο όμως,pote alo to ena ci alo to alo omos
653,/kaggle/input/audio-files/Audio_Files/j9bhm8OVMQc.wav,663.72,668.48,μπορεί να μην ξέχασα όλες αυτές τις,bori na miŋ ɡzechasa oles aftes tis
654,/kaggle/input/audio-files/Audio_Files/j9bhm8OVMQc.wav,665.72,671.2,στιγμές που ζήσαμε αλλά ούτε τον πόνο,stighmes pu zisame ala ute tom bono
655,/kaggle/input/audio-files/Audio_Files/j9bhm8OVMQc.wav,668.48,674.48,τζαί την ντροπή ξέχασα α μπράβο κυρίως,dze tin dropi ksechas alfa bravo cirios
656,/kaggle/input/audio-files/Audio_Files/j9bhm8OVMQc.wav,671.2,674.48,την ντροπή τζαί την ξεφτύλα,tin dropi dze tiŋ ɡzeftila
657,/kaggle/input/audio-files/Audio_Files/j9bhm8OVMQc.wav,676.8,682.16,άντε στετέ τα είπαμε συνεννοηθήκαμε να,ade stete ta ipame sinenoɪthikame na
658,/kaggle/input/audio-files/Audio_Files/j9bhm8OVMQc.wav,679.959,685.8,σε πάρω σστο σπίτι σου τζαί όλα έννα πάνε,se paro ssto spiti su dze ola ena pane
659,/kaggle/input/audio-files/Audio_Files/j9bhm8OVMQc.wav,682.16,689.8389999999999,καλά μη μου λες εμένα ότι όλα έννα πάνε,kala mi mu les emena oti ola ena pane
660,/kaggle/input/audio-files/Audio_Files/j9bhm8OVMQc.wav,685.8,692.8,καλά αν σε αφήσω να ξαναπάς στην κρήτη,kala an se afiso na ksanapas stiŋ ɡriti
661,/kaggle/input/audio-files/Audio_Files/j9bhm8OVMQc.wav,689.8389999999999,694.92,να μη σώσω να ξημερωθώ που να κάτσει κεί,na mi soso na ksimerotho pu na katsi ci
662,/kaggle/input/audio-files/Audio_Files/j9bhm8OVMQc.wav,692.8,697.76,που πάνω της καιι εγώ που πάνω θιον της,pu pano tis cei egho pu pano thion dis
663,/kaggle/input/audio-files/Audio_Files/j9bhm8OVMQc.wav,694.92,700.639,ήμαρτον παναγία μου ήμαρτον έννα σε,imartom banajia mu imarton ena se
664,/kaggle/input/audio-files/Audio_Files/j9bhm8OVMQc.wav,697.76,701.68,σκότωνε ματθαίο κανείς εν έννα με,skotone mattheo kanis en ena me
665,/kaggle/input/audio-files/Audio_Files/j9bhm8OVMQc.wav,700.639,705.48,σκοτώσει η,skotosi ita
666,/kaggle/input/audio-files/Audio_Files/j9bhm8OVMQc.wav,701.68,706.519,στετέ τζαί σε παρακαλώ μην καταριέσαι,stete dze se parakalo miŋ ɡatariese
667,/kaggle/input/audio-files/Audio_Files/j9bhm8OVMQc.wav,705.48,709.88,την,tin
668,/kaggle/input/audio-files/Audio_Files/j9bhm8OVMQc.wav,706.519,712.48,αναστασία δεύτερη φορά που το προσπαθεί,anastasia thefteri fora pu to prospathi
669,/kaggle/input/audio-files/Audio_Files/j9bhm8OVMQc.wav,709.88,716.8,έννα περιμένουμε την,ena perimenume tin
670,/kaggle/input/audio-files/Audio_Files/j9bhm8OVMQc.wav,712.48,720.56,τρίτη μου τα είπε όλα ο νεκτάριος ποια,triti mu ta ipe ola o nektarios pia
671,/kaggle/input/audio-files/Audio_Files/j9bhm8OVMQc.wav,716.8,723.48,όλα δηλαδή ότι ήρθεν ο,ola thilathi oti irthen omikron
672,/kaggle/input/audio-files/Audio_Files/j9bhm8OVMQc.wav,720.56,726.2,αχιλλέας ότι τον,açileas oti ton
673,/kaggle/input/audio-files/Audio_Files/j9bhm8OVMQc.wav,723.48,729.839,έδιωξες τον πήρα τζαί εγώ,ethiokses tom bira dze egho
674,/kaggle/input/audio-files/Audio_Files/j9bhm8OVMQc.wav,726.2,731.16,τηλέφωνο εν έκανες καλά πρόδωσε τα,tilefono en ekanes kala prothose ta
675,/kaggle/input/audio-files/Audio_Files/j9bhm8OVMQc.wav,729.839,735.24,αδέρφια του,atherfia tu
676,/kaggle/input/audio-files/Audio_Files/j9bhm8OVMQc.wav,731.16,739.32,στετέ ναι αλλά εγώ εν ξέρω το λόγο που,stete ne ala egho eŋ ɡzero to logho pu
677,/kaggle/input/audio-files/Audio_Files/j9bhm8OVMQc.wav,735.24,743.6,πρόδωσε τα αδέρφια του κάτι μου κρύβεται,prothose t atherfia tu kati mu krivete
678,/kaggle/input/audio-files/Audio_Files/j9bhm8OVMQc.wav,739.32,745.68,ε στετέ τίποτα εν σου κρύβουμε άντε σε,epsilon stete tipota en su krivume ade se
679,/kaggle/input/audio-files/Audio_Files/j9bhm8OVMQc.wav,743.6,747.8389999999999,παρακαλώ πάμε να σε πάρω έσσω σου,parakalo pame na se paro esso su
680,/kaggle/input/audio-files/Audio_Files/j9bhm8OVMQc.wav,745.68,753.24,να κοιμηθείς είμαι κουρασμένος τα λέμε,na cimithis ime kurasmenos ta leme
681,/kaggle/input/audio-files/Audio_Files/j9bhm8OVMQc.wav,747.8389999999999,755.8389999999999,αύριο ε κι εσύ έβαλε να σε,avrio epsilon ci esi evale na se
682,/kaggle/input/audio-files/Audio_Files/j9bhm8OVMQc.wav,753.24,758.72,πυροβολήσουν τζαί εν είσαι θυμωμένος,pirovolisun dze en ise thimomenos
683,/kaggle/input/audio-files/Audio_Files/j9bhm8OVMQc.wav,755.8389999999999,758.72,καθόλου με την,katholu me tin
684,/kaggle/input/audio-files/Audio_Files/j9bhm8OVMQc.wav,759.76,764.279,αναστασία έννα σε σκότωνε,anastasia ena se skotone
685,/kaggle/input/audio-files/Audio_Files/j9bhm8OVMQc.wav,818.399,824.199,έλα,ela
686,/kaggle/input/audio-files/Audio_Files/j9bhm8OVMQc.wav,819.92,826.9590000000001,σηφη εν είμαι αθήνα είμαι κύπρο γιατί,sifi en ime athina ime cipro jati
687,/kaggle/input/audio-files/Audio_Files/j9bhm8OVMQc.wav,824.199,830.399,εν σε π πίστεψα γιατί εν σε πίστεψα,en se pi pistepsa jati en se pistepsa
688,/kaggle/input/audio-files/Audio_Files/j9bhm8OVMQc.wav,826.9590000000001,834.72,όταν μου είπες ότι ο μαθεος έννα,otan mu ipes oti o matheos ena
689,/kaggle/input/audio-files/Audio_Files/j9bhm8OVMQc.wav,830.399,836.68,παντρευτεί ήρθα εδώ ναι ήθελα να,padrefti irtha etho ne ithela na
690,/kaggle/input/audio-files/Audio_Files/j9bhm8OVMQc.wav,834.72,838.32,μιλήσουμε να μου εξηγήσει ούτε ένας,milisume na mu eksijisi ute enas
691,/kaggle/input/audio-files/Audio_Files/j9bhm8OVMQc.wav,836.68,842.639,μήνας εν πέρασε από τότε που χωρίσαμε,minas em berase apo tote pu chorisame
692,/kaggle/input/audio-files/Audio_Files/j9bhm8OVMQc.wav,838.32,844.759,τζαί ξέρεις ήντα σσιάζουμαι σσιάζουμαι αυτόν γαμπρό,dze kseris ida ssjazume ssjazume afton ghabro
693,/kaggle/input/audio-files/Audio_Files/j9bhm8OVMQc.wav,842.639,846.88,να γελάει τζαί να κρατάει τη νύφη τζαί να,na jelai dze na kratai ti nifi dze na
694,/kaggle/input/audio-files/Audio_Files/j9bhm8OVMQc.wav,844.759,852.519,τη φυλάει αυτό,ti filai afto
695,/kaggle/input/audio-files/Audio_Files/j9bhm8OVMQc.wav,846.88,852.519,σσιάζουμαι γιατί εν μ άφησες να πεθανω τοτε,ssjazume jati en mi afisez na pethano tote
696,/kaggle/input/audio-files/Audio_Files/j9bhm8OVMQc.wav,875.24,883.24,δε με αγαπάς πια σου πέρασε πες,the me aghapas pça su perase pes
697,/kaggle/input/audio-files/Audio_Files/j9bhm8OVMQc.wav,878.92,885.88,το εν τα πιστεύεις αυτά που λες μωρο,to en da pistevis afta pu lez moro
698,/kaggle/input/audio-files/Audio_Files/j9bhm8OVMQc.wav,883.24,888.639,μου είσαι όλη μου η,mu ise oli mu ita
699,/kaggle/input/audio-files/Audio_Files/j9bhm8OVMQc.wav,885.88,890.36,ζωή έλα πες μου ότι εν τα πιστεύεις,zoi ela pez mu oti en da pistevis
700,/kaggle/input/audio-files/Audio_Files/j9bhm8OVMQc.wav,888.639,894.0,αυτά που,afta pu
701,/kaggle/input/audio-files/Audio_Files/j9bhm8OVMQc.wav,890.36,896.9590000000001,λες με άφησες τζαί πήγες στην κρήτη κι,lez me afises dze pijes stiŋ ɡriti ci
702,/kaggle/input/audio-files/Audio_Files/j9bhm8OVMQc.wav,894.0,899.279,εγώ μόλις είχα χάσει το μωρό μας,egho molis icha chasi to moro mas
703,/kaggle/input/audio-files/Audio_Files/j9bhm8OVMQc.wav,896.9590000000001,901.759,καταλαβαίνω πυροβόλησαν τον αδερφό σου,katalaveno pirovolisan don atherfo su
704,/kaggle/input/audio-files/Audio_Files/j9bhm8OVMQc.wav,899.279,904.88,αλλά κι εγώ σε χρειαζόμουν ήθελα να σαι,ala ci egho se chrçazomun ithela na se
705,/kaggle/input/audio-files/Audio_Files/j9bhm8OVMQc.wav,901.759,907.72,εδώ μαζί μου φοβήθηκα για σένα μου,etho mazi mu fovithika ja sena mu
706,/kaggle/input/audio-files/Audio_Files/j9bhm8OVMQc.wav,904.88,909.32,πέρασαν κακές σκέψεις απ το μυαλό ήντα έννα,perasaŋ ɡaces scepsis ap to mialo ida ena
707,/kaggle/input/audio-files/Audio_Files/j9bhm8OVMQc.wav,907.72,914.0,κάνω μαζί σου μου,kano mazi su mu
708,/kaggle/input/audio-files/Audio_Files/j9bhm8OVMQc.wav,909.32,918.12,λες σου την έσπασα πολύ ε ναι,les su tin espasa poli epsilon ne
709,/kaggle/input/audio-files/Audio_Files/j9bhm8OVMQc.wav,914.0,918.12,πολύ αλλά μόνο για μισή,poli ala mono ja misi
710,/kaggle/input/audio-files/Audio_Files/j9bhm8OVMQc.wav,920.36,927.959,ώρα ώρο μου εν μπορούμε να ζήσουμε,ora oro mu en borume na zisume
711,/kaggle/input/audio-files/Audio_Files/j9bhm8OVMQc.wav,924.839,931.36,άλλου σαν κυνηγημένοι το ξέρω αλλά όι,alu saŋ ɡinijimeni to ksero ala oɪ
712,/kaggle/input/audio-files/Audio_Files/j9bhm8OVMQc.wav,927.959,933.04,ακόμα ο σήφης ήρθε στο λονδίνο όρμησε,akoma o sifis irthe sto lonthino ormise
713,/kaggle/input/audio-files/Audio_Files/j9bhm8OVMQc.wav,931.36,935.959,μέσα έσσω τα,mesa esso ta
714,/kaggle/input/audio-files/Audio_Files/j9bhm8OVMQc.wav,933.04,938.8,ξέχασες αν το μάθει έννα σε,ksechases an do mathi ena se
715,/kaggle/input/audio-files/Audio_Files/j9bhm8OVMQc.wav,935.959,940.56,σκοτώσει αχιλλέα έννα σε σκοτώσει θες να,skotosi açilea ena se skotosi thez na
716,/kaggle/input/audio-files/Audio_Files/j9bhm8OVMQc.wav,938.8,943.16,πεθάνω,pethano
717,/kaggle/input/audio-files/Audio_Files/j9bhm8OVMQc.wav,940.56,945.519,ωραία τζαί πότε έννα το,orea dze pote ena to
718,/kaggle/input/audio-files/Audio_Files/j9bhm8OVMQc.wav,943.16,948.399,μάθει πες μου,mathi pez mu
719,/kaggle/input/audio-files/Audio_Files/j9bhm8OVMQc.wav,945.519,950.16,πότε σε λίγο καιρό μπορεί να χαλαρώσει,pote se ligho cero bori na chalarosi
720,/kaggle/input/audio-files/Audio_Files/j9bhm8OVMQc.wav,948.399,954.8,κάτι να,kati na
721,/kaggle/input/audio-files/Audio_Files/j9bhm8OVMQc.wav,950.16,957.24,γίνει είδες τις διαθέσεις του λαόνουμαι,jini ithes tiz thiathesis tu laonume
722,/kaggle/input/audio-files/Audio_Files/j9bhm8OVMQc.wav,954.8,959.68,αχιλλέα μην κάνεις καμιά περίσκεψη,açilea miŋ ɡanis kamia periscepsi
723,/kaggle/input/audio-files/Audio_Files/j9bhm8OVMQc.wav,957.24,959.68,λαόνουμαι,laonume
724,/kaggle/input/audio-files/Audio_Files/j9bhm8OVMQc.wav,977.519,983.12,ήντα έγινε ήντα έμαθες η δική μου το παίξανε,ida ejine ida emathes i thici mu to peksane
725,/kaggle/input/audio-files/Audio_Files/j9bhm8OVMQc.wav,981.24,986.44,τσαντάκηδες τζαί της πήρανε την τσάντα,tsadacithes dze tis pirane tin dzada
726,/kaggle/input/audio-files/Audio_Files/j9bhm8OVMQc.wav,983.12,989.92,τραυματίσετε λίγο ωραία πάρ τον τηλέφωνο,travmatisete ligho orea par ton dilefono
727,/kaggle/input/audio-files/Audio_Files/j9bhm8OVMQc.wav,986.44,994.519,τζαί δώς του σήμα βρε δική,dze thos tu sima vre thici
728,/kaggle/input/audio-files/Audio_Files/j9bhm8OVMQc.wav,989.92,996.319,άστο γ απόψε εν θέλω ήντα κάνεις πίσω πες,asto gham apopse en thelo ida kanis piso pes
729,/kaggle/input/audio-files/Audio_Files/j9bhm8OVMQc.wav,994.519,1000.319,μου αντώνη κάνεις,mu adoni kanis
730,/kaggle/input/audio-files/Audio_Files/j9bhm8OVMQc.wav,996.319,1002.92,πίσω ήντα εν καταλαβαίνεις ο αχιλλέας,piso ida eŋ ɡatalavenis o açileas
731,/kaggle/input/audio-files/Audio_Files/j9bhm8OVMQc.wav,1000.319,1004.759,πρέπει να επιστρέψει στην κύπρο μόνιμα,prepi na epistrepsi stiŋ ɡipro monima
732,/kaggle/input/audio-files/Audio_Files/j9bhm8OVMQc.wav,1002.92,1006.48,ακόμα τζαί αν τον φάμε αύριο μπορεί να,akoma dze an don fame avrio bori na
733,/kaggle/input/audio-files/Audio_Files/j9bhm8OVMQc.wav,1004.759,1008.56,ανακαλύψω ότι έσιει κάνει τη διαθήκη τζαί,anakalipso oti esji kani ti thiathici dze
734,/kaggle/input/audio-files/Audio_Files/j9bhm8OVMQc.wav,1006.48,1010.12,εν μου αφήνει τίποτα τζαί να προσβάλλω,en mu afini tipota dze na prosvalo
735,/kaggle/input/audio-files/Audio_Files/j9bhm8OVMQc.wav,1008.56,1011.56,τη διαθήκη τα αδέλφια του μπορούν να,ti thiathici t athelfia tu borun na
736,/kaggle/input/audio-files/Audio_Files/j9bhm8OVMQc.wav,1010.12,1013.04,αποδείξουν ότι ο γάμος μας έσιει λυθεί,apothiksun oti o ghamoz mas esji lithi
737,/kaggle/input/audio-files/Audio_Files/j9bhm8OVMQc.wav,1011.56,1015.279,ουσιαστικά επειδή αυτός έλειπε στο,usjastika epithi aftos elipe sto
738,/kaggle/input/audio-files/Audio_Files/j9bhm8OVMQc.wav,1013.04,1017.399,εξωτερικό πάνω από ένα χρόνο κινδυνεύω,eksoteriko pano apo ena chrono cinthinevo
739,/kaggle/input/audio-files/Audio_Files/j9bhm8OVMQc.wav,1015.279,1019.92,να μην πάρω μία πρέπει να τον,na mim baro mia prepi na ton
740,/kaggle/input/audio-files/Audio_Files/j9bhm8OVMQc.wav,1017.399,1021.8,αναγκάσουμε να επιστρέψει,anaŋɡasume na epistrepsi
741,/kaggle/input/audio-files/Audio_Files/j9bhm8OVMQc.wav,1019.92,1023.839,να περάσει ένα χρονικό διάστημα τζαί να,na perasi ena chroniko thiastima dze na
742,/kaggle/input/audio-files/Audio_Files/j9bhm8OVMQc.wav,1021.8,1027.799,φανεί προς τα έξω ότι έχουμε,fani pros ta ekso oti echume
743,/kaggle/input/audio-files/Audio_Files/j9bhm8OVMQc.wav,1023.839,1027.799,επανασυνδεθεί μετά τον,epanasinthethi meta ton
744,/kaggle/input/audio-files/Audio_Files/j9bhm8OVMQc.wav,1029.16,1033.72,κανονίζουμε σε ήντα ελπίζεις για να,kanonizume se ida elpiziz jana
745,/kaggle/input/audio-files/Audio_Files/j9bhm8OVMQc.wav,1031.36,1037.959,αλλάξει οο,alaksi oo
746,/kaggle/input/audio-files/Audio_Files/j9bhm8OVMQc.wav,1033.72,1041.4,σήφης να λυγίσει με το παιδί την κόρη,sifiz na lijisi me to pethi tiŋ ɡori
747,/kaggle/input/audio-files/Audio_Files/j9bhm8OVMQc.wav,1037.959,1044.919,του να έρθει πιο κοντά με κάποια γυναίκα,tu na erthi pço koda me kapia jineka
748,/kaggle/input/audio-files/Audio_Files/j9bhm8OVMQc.wav,1041.4,1044.919,εν ξέρω τον,eŋ ɡzero ton
749,/kaggle/input/audio-files/Audio_Files/j9bhm8OVMQc.wav,1045.16,1050.44,αγαπάς πες αλήθεια τον αγαπάς,aghapas pes alithça ton aghapas
750,/kaggle/input/audio-files/Audio_Files/j9bhm8OVMQc.wav,1049.4,1054.28,ήντα,ida
751,/kaggle/input/audio-files/Audio_Files/j9bhm8OVMQc.wav,1050.44,1057.08,έπαθες ζηλεύεις ξαφνικά το,epathez zilevis ksafnika to
752,/kaggle/input/audio-files/Audio_Files/j9bhm8OVMQc.wav,1054.28,1058.559,σήφη πες μου κιο όλας ότι πιστεύεις πως,sifi pez mu co olas oti pistevis pos
753,/kaggle/input/audio-files/Audio_Files/j9bhm8OVMQc.wav,1057.08,1061.52,εν θέλω να μάθει για μας επειδή,en thelo na mathi ja mas epithi
754,/kaggle/input/audio-files/Audio_Files/j9bhm8OVMQc.wav,1058.559,1064.28,σκέφτομαι μια πιθανή,sceftome mnya pithani
755,/kaggle/input/audio-files/Audio_Files/j9bhm8OVMQc.wav,1061.52,1067.12,επανασύνδεση μπορεί να γίνεται υπο,epanasinthesi bori na jinete ipo
756,/kaggle/input/audio-files/Audio_Files/j9bhm8OVMQc.wav,1064.28,1069.32,συνήθη ντάξει τόσα χρόνια τον ξέρεις,sinithi daksi tosa chronya toŋ ɡzeris
